,id,funded_amount,loan_amount,activity,sector,use,country_code,country,region,currency,partner_id,posted_time,disbursed_time,funded_time,term_in_months,lender_count,tags,borrower_genders,repayment_interval,date
497351,1157794,1400.0,1400.0,Personal Medical Expenses,Health,to pay for her necessary dental treatment,LB,Lebanon,Tayouneh,USD,77.0,2016-09-26 08:59:23,2016-09-19 07:00:00,2016-10-05 22:10:32,10.0,46,"#Health and Sanitation, #Elderly, #Widowed, #Parent, #Single, #Single Parent, user_favorite","female, female, female",monthly,2016-09-26 00:00:00
493610,1153850,300.0,300.0,Cattle,Agriculture, to purchase more animals to inflate her sales,PK,Pakistan,Oghi,PKR,245.0,2016-09-20 09:21:03,2016-08-31 07:00:00,2016-09-26 21:27:19,14.0,12,#Animals,female,monthly,2016-09-20 00:00:00
551328,1211725,175.0,175.0,Home Appliances,Personal Use,to buy a water filter to provide safe drinking water for her family.,KH,Cambodia,Battambang,KHR,311.0,2016-12-28 09:19:04,2016-12-19 08:00:00,2017-01-17 18:34:38,8.0,7,"#Eco-friendly, #Health and Sanitation, #Technology","female, male, female, male",monthly,2016-12-28 00:00:00
283175,929666,350.0,350.0,Personal Products Sales,Retail,to buy personal care products to sell.,PH,Philippines,"Silang, Cavite",PHP,144.0,2015-08-10 02:58:12,2015-07-22 07:00:00,2015-08-17 20:27:32,8.0,12,"#Parent, #Repeat Borrower, #Schooling, #Woman Owned Biz",female,irregular,2015-08-10 00:00:00
637882,1299733,475.0,475.0,Farming,Agriculture,"to buy mineral fertilizer, to receive a good harvest and income",TJ,Tajikistan,Tursun-zoda,TJS,63.0,2017-05-17 04:11:12,2017-05-11 07:00:00,2017-06-21 16:42:18,14.0,19,"#Parent, #Vegan, #Woman Owned Biz, user_favorite, user_favorite",female,monthly,2017-05-17 00:00:00
215569,863412,400.0,400.0,Higher education costs,Education,to pay for tuition for a two-month call center training program that can get her a job paying about $270 monthly.,PH,Philippines,Bago City,PHP,351.0,2015-03-29 09:18:29,2015-03-23 07:00:00,2015-04-04 17:49:56,18.0,15,user_favorite,female,monthly,2015-03-29 00:00:00
208055,856077,650.0,650.0,Food,Food,to buy cookies and chocolate among other items,PE,Peru,Cusco,PEN,119.0,2015-03-16 16:49:22,2015-02-17 08:00:00,2015-03-20 19:53:57,6.0,12,,female,irregular,2015-03-16 00:00:00
51103,703762,2400.0,2400.0,Food Stall,Food,"to purchase items for her stall, including cookies, candy, flavoring and sugar.",CG,Congo,Brazzaville,XAF,165.0,2014-04-28 18:38:00,2014-04-02 07:00:00,2014-04-30 03:50:43,5.0,6,"#Fabrics, user_favorite","female, female, female, female, female, female, female",irregular,2014-04-28 00:00:00
430904,1077511,275.0,275.0,Pigs,Agriculture,buy more pigs and food to fat them up.,CO,Colombia,San Antonio de Palmito,COP,177.0,2016-05-27 22:48:11,2016-04-27 07:00:00,2016-07-11 21:45:14,15.0,8,"#Animals, #Elderly, #Schooling, #Parent",male,bullet,2016-05-27 00:00:00
488203,1148434,450.0,450.0,Farming,Agriculture,"to buy compost, fertilizers, and corn.",PE,Peru,Challabamba - Paucartambo - Cusco,PEN,119.0,2016-09-09 16:35:36,2016-08-12 07:00:00,2016-09-10 21:08:53,6.0,6,,female,irregular,2016-09-09 00:00:00
578806,1240115,350.0,350.0,Beauty Salon,Services,to purchase equipment for hairdressing such as a large set of drawers.,CO,Colombia,Envigado,COP,177.0,2017-02-16 20:44:15,2017-01-18 08:00:00,2017-03-09 05:07:42,14.0,4,"#Woman Owned Biz, #Biz Durable Asset, #Parent",female,bullet,2017-02-16 00:00:00
625950,1287299,275.0,275.0,General Store,Retail,"to purchase additional stocks like soap, sardines, sugar, etc. to sell",PH,Philippines,"Kabankalan, Negros Occidental",PHP,145.0,2017-04-27 02:36:19,2017-03-28 07:00:00,2017-05-03 19:55:17,8.0,1,,female,irregular,2017-04-27 00:00:00
503262,1163828,525.0,525.0,Personal Housing Expenses,Housing,"Mequelina buy sand, cement, and galvanized sheet metal.",MZ,Mozambique,Namaacha,MZN,23.0,2016-10-06 12:28:05,2016-09-21 07:00:00,2016-10-25 23:44:28,20.0,13,,female,monthly,2016-10-06 00:00:00
665795,1329814,800.0,800.0,General Store,Retail,"to buy personal care products, grocery supplies and other items.",EC,Ecuador,Tulcán,USD,188.0,2017-06-29 15:08:57,2017-06-06 07:00:00,2017-07-11 12:27:19,14.0,17,"user_favorite, user_favorite",male,monthly,2017-06-29 00:00:00
20403,673974,600.0,600.0,Personal Housing Expenses,Housing,to buy sheet metal and wood,SV,El Salvador,,USD,81.0,2014-02-20 22:56:47,2014-02-13 08:00:00,2014-03-30 20:06:35,17.0,21,"#Elderly, #Supporting Family",female,monthly,2014-02-20 00:00:00
196931,844777,150.0,150.0,Pigs,Agriculture,to buy feed and vitamins for her pigs,PH,Philippines,"Tacloban City, Leyte",PHP,145.0,2015-02-23 03:45:28,2015-02-16 08:00:00,2015-02-26 00:29:16,8.0,6,"volunteer_pick, volunteer_like",female,irregular,2015-02-23 00:00:00
87964,739758,350.0,350.0,Used Clothing,Clothing,to purchase bales of second-hand clothes for resale,KE,Kenya,Kisumu,KES,133.0,2014-07-16 13:44:05,2014-07-08 07:00:00,2014-08-02 14:55:18,11.0,9,"#Eco-friendly, #Repeat Borrower",female,monthly,2014-07-16 00:00:00
356657,1003111,275.0,275.0,Fishing,Food,to purchase additional materials and gear for her business.,PH,Philippines,"Bais, Negros Oriental",PHP,145.0,2016-01-04 03:47:58,2015-12-04 08:00:00,2016-01-12 02:47:41,13.0,10,"#Animals, #Parent, #Woman Owned Biz",female,irregular,2016-01-04 00:00:00
367597,1014747,525.0,525.0,Tailoring,Services,to buy tailoring equipment.,LB,Lebanon,Sidon,LBP,404.0,2016-01-27 15:38:12,2016-01-25 08:00:00,2016-02-17 21:07:45,15.0,5,"#Biz Durable Asset, #First Loan, #Parent, #Fabrics",female,monthly,2016-01-27 00:00:00
280405,927649,1500.0,1500.0,Poultry,Agriculture,"to purchase feed, preventive medicine for laying hens, vitamins, chickens, etc.",SV,El Salvador,,USD,81.0,2015-08-04 16:08:00,2015-08-23 07:00:00,2015-09-07 17:35:55,25.0,51,"#Animals, #Woman Owned Biz, user_favorite",female,monthly,2015-08-04 00:00:00
446351,1106374,650.0,650.0,Food Stall,Food,to buy ingredients needed for her eatery business.,PH,Philippines,Novaliches City,PHP,144.0,2016-06-26 19:41:33,2016-06-15 07:00:00,2016-07-05 15:59:17,8.0,17,"user_favorite, user_favorite",female,irregular,2016-06-26 00:00:00
492133,1152229,275.0,625.0,Clothing Sales,Clothing,to buy a variety of clothing items for both sexes in order to renovate the merchandise in her inventory so that her customers find what they need.,SV,El Salvador,,USD,167.0,2016-09-17 15:51:34,2016-08-26 07:00:00,,17.0,11,"#Repeat Borrower, #Parent, #Woman Owned Biz, user_favorite",female,monthly,2016-09-17 00:00:00
646648,1308790,225.0,225.0,Personal Housing Expenses,Housing,to build a sanitary toilet for her family.,PH,Philippines,"Binalbagan 2, Negros Occicental",PHP,145.0,2017-05-29 07:40:15,2017-05-12 07:00:00,2017-06-07 00:05:21,13.0,9,"#Eco-friendly, #Health and Sanitation, #Parent",female,irregular,2017-05-29 00:00:00
78297,1081957,1000.0,1000.0,Clothing,Clothing,"hire an online employee, maximizing our shops monthly income. ",US,United States,,USD,,2014-06-24 23:57:20,2014-10-04 16:43:06,2014-10-04 23:42:59,12.0,44,,male,monthly,2014-06-24 00:00:00
161648,810455,225.0,225.0,Food Stall,Food,to purchase fruits and meat for sale in her business.,KE,Kenya,Kisauni,KES,164.0,2014-12-04 09:23:58,2014-12-04 08:00:00,2014-12-20 22:25:41,13.0,4,"#Parent, #Woman Owned Biz",female,irregular,2014-12-04 00:00:00
517056,1177484,175.0,175.0,Fish Selling,Food,to buy additional fish. ,PH,Philippines,"Sara, Iloilo",PHP,125.0,2016-10-31 05:58:47,2016-09-30 07:00:00,2016-11-13 01:24:01,9.0,5,user_favorite,female,irregular,2016-10-31 00:00:00
106329,758329,375.0,375.0,Farming,Agriculture,to maintain his cocao bean crop,PE,Peru,San Martín,PEN,139.0,2014-08-21 23:40:32,2014-07-25 07:00:00,2014-09-09 17:15:15,10.0,14,"#Vegan, #Parent, #Supporting Family",male,bullet,2014-08-21 00:00:00
474744,1134716,175.0,175.0,Pigs,Agriculture,"to buy feed, vitamins, and other supplies to raise her livestock.",PH,Philippines,"Talibon, Bohol",PHP,145.0,2016-08-18 03:10:36,2016-08-05 07:00:00,2016-08-26 21:47:26,7.0,1,"#Animals, #Woman Owned Biz, #Elderly",female,irregular,2016-08-18 00:00:00
378260,1025063,1875.0,1875.0,Pigs,Agriculture,to buy pigs.,CR,Costa Rica,Cartago,CRC,127.0,2016-02-18 16:58:03,2016-03-02 08:00:00,2016-03-18 01:41:16,38.0,61,"#Animals, user_favorite, user_favorite",male,monthly,2016-02-18 00:00:00
209463,857305,350.0,350.0,General Store,Retail,"To pay for groceries, toiletries, cell phone cases and prepaid phone cards to sell",PH,Philippines,"Coron, Palawan",PHP,144.0,2015-03-18 06:30:54,2015-02-20 08:00:00,2015-03-23 20:37:36,25.0,7,,female,monthly,2015-03-18 00:00:00
352250,998822,225.0,225.0,Grocery Store,Food,to purchase additional grocery items to sell.,PH,Philippines,"Maningcol, Ozamis City, Misamis Occidental",PHP,136.0,2015-12-22 08:25:26,2015-12-17 08:00:00,2015-12-24 16:13:43,10.0,1,,female,monthly,2015-12-22 00:00:00
127849,778548,500.0,500.0,Personal Housing Expenses,Housing,to build a hygienic latrine.,KH,Cambodia,Pursat,KHR,106.0,2014-10-03 07:40:02,2014-09-09 07:00:00,2014-10-09 07:44:56,14.0,19,user_favorite,female,monthly,2014-10-03 00:00:00
483774,1143493,125.0,125.0,Pigs,Agriculture,"to buy feeds, vitamins, and other supplies needed to raise her livestock",PH,Philippines,Sogod Leyte,PHP,145.0,2016-09-01 05:23:09,2016-08-03 07:00:00,2016-09-10 17:15:45,7.0,1,,female,irregular,2016-09-01 00:00:00
363580,1010483,275.0,275.0,Cattle,Agriculture,To purchase cows for her existing business.,IN,India,Khagrabari,INR,334.0,2016-01-19 12:50:27,2015-12-23 08:00:00,2016-01-21 21:41:11,43.0,9,,female,bullet,2016-01-19 00:00:00
581524,1241558,175.0,175.0,General Store,Retail,"to buy items to sell like canned goods, eggs, home care products, and other groceries.",PH,Philippines,Sogod Leyte,PHP,145.0,2017-02-20 01:21:43,2017-01-20 08:00:00,2017-02-25 04:04:51,8.0,4,"#Parent, #Woman Owned Biz",female,irregular,2017-02-20 00:00:00
332435,979145,250.0,250.0,Personal Housing Expenses,Housing,to install a toilet in her home,IN,India,"Korba,Chattisgarh",INR,241.0,2015-11-16 07:32:26,2015-11-06 08:00:00,2015-11-19 22:31:22,43.0,9,user_favorite,female,bullet,2015-11-16 00:00:00
231015,878481,250.0,250.0,Livestock,Agriculture,to increase the number of livestock and keep her business,TJ,Tajikistan,Jilikul,TJS,63.0,2015-04-30 05:32:58,2015-04-10 07:00:00,2015-05-02 11:53:02,14.0,8,,female,monthly,2015-04-30 00:00:00
529257,1189761,350.0,350.0,Farming,Agriculture,to purchase fertilizer for her rice farming,KH,Cambodia,Takeo province,KHR,9.0,2016-11-22 04:42:11,2016-10-24 07:00:00,2016-11-28 06:53:05,15.0,11,,"female, female",monthly,2016-11-22 00:00:00
356070,1002916,500.0,500.0,Clothing Sales,Clothing,to buy winter season clothing for reselling by herself from her home.,PK,Pakistan,Lahore,PKR,247.0,2016-01-01 06:44:20,2015-12-23 08:00:00,2016-01-22 04:42:34,11.0,16,"#Fabrics, #Parent, #Woman Owned Biz, user_favorite",female,irregular,2016-01-01 00:00:00
546343,1206652,425.0,425.0,Primary/secondary school costs,Education,to be used in paying her child's tuition fee.,PH,Philippines,"Jimenez-Naga,Jimenez,Misamis Occidental",PHP,126.0,2016-12-20 06:49:15,2016-11-29 08:00:00,2016-12-23 14:03:26,15.0,11,"#Schooling, #Elderly, user_favorite",female,monthly,2016-12-20 00:00:00
267063,914099,1200.0,1200.0,Services,Services,to purchase a kiosk and a mobile phone and to provide funds needed for her to run her business,MW,Malawi,Dedza,MWK,444.0,2015-07-07 09:11:46,2015-07-27 07:00:00,2015-07-19 20:55:29,24.0,35,"#Woman Owned Biz, #Technology, #Biz Durable Asset, #Inspiring Story, #Single",female,monthly,2015-07-07 00:00:00
648378,1311060,575.0,575.0,Food Production/Sales,Food,to buy charcoal and a machine for roasting fish.,UG,Uganda,Kasese,UGX,163.0,2017-05-31 09:25:55,2017-05-24 07:00:00,2017-06-14 23:15:34,10.0,9,"user_favorite, #Biz Durable Asset",male,monthly,2017-05-31 00:00:00
210376,858538,1175.0,1175.0,General Store,Retail,to purchase a variety of drinks for sale. ,PY,Paraguay,San Pedro,PYG,58.0,2015-03-19 19:17:03,2015-02-18 08:00:00,2015-04-22 07:49:46,15.0,47,"#Repeat Borrower, #Woman Owned Biz, #Elderly, user_favorite",female,monthly,2015-03-19 00:00:00
34949,687547,225.0,225.0,General Store,Retail,"to buy more rice and other goods like noodles, soda, and canned goods to sell",PH,Philippines,"Bien Unido, Bohol",PHP,125.0,2014-03-22 06:06:08,2014-03-06 08:00:00,2014-03-24 17:22:42,7.0,7,,male,irregular,2014-03-22 00:00:00
624622,1286820,325.0,325.0,General Store,Retail,"to buy items to sell like canned goods, personal care products, etc.",PH,Philippines,"Manapla, Negros Occidental",PHP,145.0,2017-04-26 12:00:36,2017-03-27 07:00:00,2017-05-18 12:37:48,14.0,11,"#Parent, #Woman Owned Biz",female,irregular,2017-04-26 00:00:00
34565,1080804,250.0,250.0,Grocery Store,Food,buy 2 Barbecue Grills and add more stock of meat in my business.,KE,Kenya,,KES,,2014-03-21 10:45:17,2014-04-02 19:14:28,2014-03-27 08:41:33,2.0,8,,female,irregular,2014-03-21 00:00:00
588238,1269749,1000.0,1000.0,General Store,Retail,purchase doors for the property to reduce vandalism. ,US,United States,,USD,,2017-03-02 22:51:11,2017-05-09 22:38:13,2017-04-12 20:54:32,12.0,20,"#Biz Durable Asset, #Woman Owned Biz, #Parent",female,monthly,2017-03-02 00:00:00
133153,783813,575.0,575.0,Primary/secondary school costs,Education,to pay education expenses,NI,Nicaragua,Chinandega,NIO,74.0,2014-10-15 23:06:21,2014-10-08 07:00:00,2014-10-29 15:09:39,14.0,23,"volunteer_like, #Schooling, #Hidden Gem",female,irregular,2014-10-15 00:00:00
285279,932194,325.0,325.0,Fuel/Firewood,Retail,to buy additional stocks of firewood to sell.,PH,Philippines,"Binalbagan, Negros Occidental",PHP,145.0,2015-08-14 07:32:26,2015-08-06 07:00:00,2015-09-12 07:36:51,13.0,8,"#Parent, #Repeat Borrower, #Woman Owned Biz",female,irregular,2015-08-14 00:00:00
256251,903610,350.0,350.0,Fuel/Firewood,Retail,to buy gasoline to sell in her business.,PH,Philippines,"Calbayog City, Samar",PHP,145.0,2015-06-18 02:44:06,2015-06-10 07:00:00,2015-06-21 20:03:07,7.0,10,,female,irregular,2015-06-18 00:00:00
191258,840129,975.0,975.0,Transportation,Transportation,repair and service his taxi which is in a poor state of repair,PE,Peru,Oyotún - Chiclayo,PEN,143.0,2015-02-12 23:33:35,2015-01-16 08:00:00,2015-03-15 05:33:33,14.0,22,"user_favorite, #Supporting Family, user_favorite, user_favorite, #Biz Durable Asset",male,monthly,2015-02-12 00:00:00
450799,1110718,1350.0,1350.0,Textiles,Arts,"to buy stencils, brushes, rollers, wooden carved designs, material, fabric paint, and a new cutter",WS,Samoa,Solo Solo,WST,15.0,2016-07-03 02:46:19,2016-06-30 07:00:00,2016-07-21 05:39:17,14.0,50,"#Fabrics, user_favorite, #Single Parent, #Parent, #Biz Durable Asset, #Woman Owned Biz, user_favorite",female,irregular,2016-07-03 00:00:00
492879,1152411,325.0,325.0,Fish Selling,Food,to buy more sea foods to sell.,PH,Philippines,"Hinigaran, Negros Occidental",PHP,145.0,2016-09-19 02:51:05,2016-08-30 07:00:00,2016-09-19 10:43:47,8.0,10,"#Woman Owned Biz, #Repeat Borrower, #Parent",female,irregular,2016-09-19 00:00:00
273492,920762,375.0,375.0,Retail,Retail,to open a retail business.,TZ,Tanzania,Rufiji,TZS,379.0,2015-07-21 13:53:39,2015-06-24 07:00:00,2015-07-27 00:45:27,8.0,11,"#Single, #Supporting Family, #Woman Owned Biz, #Low-profit FP",female,irregular,2015-07-21 00:00:00
553905,1214425,500.0,500.0,Farming,Agriculture,to purchase a solar light and gain access to cost efficient hybrid seeds and fertilizer for maize cultivation.							,KE,Kenya,Webuye,KES,202.0,2017-01-03 09:32:50,2017-02-01 08:00:00,2017-01-04 04:46:02,11.0,20,"#Sustainable Ag, #Eco-friendly, #Parent, #Schooling, #Technology, user_favorite, user_favorite","female, female, female, male, male, female, female, female",bullet,2017-01-03 00:00:00
599612,1260969,400.0,400.0,Pigs,Agriculture,to buy feed and vitamins for her pigs.,PH,Philippines,"Himamaylan, Negros Occidental",PHP,145.0,2017-03-20 04:09:55,2017-03-02 08:00:00,2017-03-23 08:33:33,7.0,11,"#Woman Owned Biz, #Elderly, #Repeat Borrower, #Animals, user_favorite, user_favorite",female,irregular,2017-03-20 00:00:00
446757,1106545,175.0,175.0,Home Appliances,Personal Use,to buy a water filter to provide safe drinking water for her family.,KH,Cambodia,Battambang,KHR,311.0,2016-06-27 02:49:44,2016-06-05 07:00:00,2016-07-04 14:36:47,8.0,7,"#Health and Sanitation, #Technology, #Eco-friendly","female, female",monthly,2016-06-27 00:00:00
133390,783962,125.0,125.0,Food Production/Sales,Food,to buy ingredients for her food business.,PH,Philippines,"San Carlos, Negros Occidental",PHP,145.0,2014-10-16 06:38:32,2014-09-26 07:00:00,2014-10-20 15:32:41,8.0,5,,female,irregular,2014-10-16 00:00:00
111543,763253,775.0,775.0,Clothing Sales,Clothing,to buy clothing.,EC,Ecuador,Cuenca,USD,137.0,2014-09-02 22:54:52,2014-08-06 07:00:00,2014-09-20 19:47:31,8.0,29,"volunteer_like, volunteer_pick, #Repeat Borrower, #Fabrics, #Parent",female,irregular,2014-09-02 00:00:00
19298,672274,200.0,200.0,Food Market,Food,to purchase more bags of native rice and general stock for resale. ,SL,Sierra Leone,Masuba town,SLL,183.0,2014-02-18 17:10:50,2014-01-27 08:00:00,2014-02-20 06:59:11,12.0,7,user_favorite,female,irregular,2014-02-18 00:00:00
608919,1269842,1050.0,1050.0,Food Production/Sales,Food,to purchase more ingredients for cake-making also to start selling wrapped rice.,ID,Indonesia,,IDR,129.0,2017-03-30 02:16:18,2017-03-09 08:00:00,2017-04-21 14:55:46,13.0,31,"#Parent, #Woman Owned Biz","female, female, female, female, female",irregular,2017-03-30 00:00:00
1208,654219,250.0,250.0,Tailoring,Services,"to purchase cloth materials, and sewing threads for her business.",KE,Kenya,Tiribe,KES,164.0,2014-01-06 12:55:38,2013-12-25 08:00:00,2014-01-07 02:55:36,14.0,6,,female,irregular,2014-01-06 00:00:00
110891,762199,1075.0,1075.0,Farming,Agriculture,"to buy fertilizer, a spade, a new crowbar, a tiller, chemicals, gloves, a new chain-saw and sprayers",WS,Samoa,Nofoalii,WST,15.0,2014-08-30 03:09:07,2014-07-31 07:00:00,2014-10-01 11:08:56,14.0,40,"#Biz Durable Asset, #Elderly, #Woman Owned Biz, user_favorite",female,irregular,2014-08-30 00:00:00
416081,1062922,350.0,350.0,Pigs,Agriculture,to buy pigs and feed,CO,Colombia,Sahagun,COP,177.0,2016-04-29 15:53:32,2016-03-31 07:00:00,2016-05-08 13:11:41,15.0,9,"volunteer_pick, #Animals, #Elderly, #Woman Owned Biz",female,bullet,2016-04-29 00:00:00
52559,705001,700.0,700.0,Farming,Agriculture,"to buy weed-killers, fertilizers, pesticides, tools, etc.",SV,El Salvador,,USD,81.0,2014-04-30 23:04:37,2014-04-09 07:00:00,2014-06-10 19:02:15,13.0,28,"#Vegan, #Supporting Family, user_favorite",female,bullet,2014-04-30 00:00:00
3177,656031,800.0,800.0,General Store,Retail,"to buy grocery items, medicines, and drinks for her general store",PH,Philippines,"Agliam, San Manuel, Isabela",PHP,123.0,2014-01-10 08:20:59,2013-12-19 08:00:00,2014-01-17 15:21:47,8.0,25,user_favorite,female,irregular,2014-01-10 00:00:00
164703,813122,800.0,800.0,General Store,Retail,to buy supplies to sell in her general store.,TL,Timor-Leste,Oe-cusse,USD,243.0,2014-12-11 00:50:11,2014-11-24 08:00:00,2014-12-20 21:07:12,15.0,30,"user_favorite, #Woman Owned Biz",female,monthly,2014-12-11 00:00:00
63658,716183,4100.0,4100.0,Cosmetics Sales,Retail,"purchase creams, lipstick and perfumes.",PE,Peru,Cusco,PEN,119.0,2014-05-26 16:46:57,2014-04-26 07:00:00,2014-06-14 02:39:16,6.0,84,"user_favorite, #Repeat Borrower","female, male, female, female, female, female, female, female",irregular,2014-05-26 00:00:00
376101,1022864,1075.0,1075.0,Pharmacy,Health,to buy more stock of medicine and vitamins to sell to her customers.,PH,Philippines,"Sibulan, Negros Oriental",PHP,145.0,2016-02-15 13:48:11,2016-01-29 08:00:00,2016-02-19 17:42:17,8.0,27,"#Health and Sanitation, #Widowed, #Parent, #Repeat Borrower, #Single Parent",female,irregular,2016-02-15 00:00:00
454327,1114138,400.0,400.0,Clothing Sales,Clothing,to buy more stocks of clothing to sell,ZW,Zimbabwe,Gweru,USD,433.0,2016-07-11 06:30:22,2016-07-04 07:00:00,2016-07-18 00:23:15,8.0,15,,male,monthly,2016-07-11 00:00:00
419181,1065684,225.0,925.0,Farming,Agriculture,to pay labor for pruning cocoa gardens.,UG,Uganda,Bundibugyo,UGX,163.0,2016-05-06 14:49:52,2016-04-12 07:00:00,,10.0,8,"#Elderly, #Job Creator, #Parent, #Schooling, #Vegan",male,monthly,2016-05-06 00:00:00
484478,1144721,325.0,325.0,General Store,Retail,to purchase more stocks to sell in her general store,PH,Philippines,"Bindoy, Negros Oriental",PHP,145.0,2016-09-02 14:34:54,2016-08-22 07:00:00,2016-09-12 12:52:22,8.0,1,,female,irregular,2016-09-02 00:00:00
351526,998085,225.0,225.0,Livestock,Agriculture,to buy feeds and other supplies to raise her livestock,PH,Philippines,"Canlaon, Negros Oriental",PHP,145.0,2015-12-21 06:54:54,2015-11-20 08:00:00,2015-12-30 04:26:52,13.0,9,"#Parent, #Animals, #Repeat Borrower, #Woman Owned Biz",female,irregular,2015-12-21 00:00:00
459389,1119740,100.0,100.0,Pigs,Agriculture,"to buy feed, vitamins, and other supplies to raise her livestock.",PH,Philippines,Sogod Leyte,PHP,145.0,2016-07-20 09:22:06,2016-06-20 07:00:00,2016-07-29 18:45:19,8.0,1,,female,irregular,2016-07-20 00:00:00
193466,841716,1450.0,1450.0,Retail,Retail,To purchase clothing and cheese.  ,EC,Ecuador,Jipijapa,USD,137.0,2015-02-16 23:18:13,2015-01-28 08:00:00,2015-02-18 12:49:35,7.0,24,,female,monthly,2015-02-16 00:00:00
622268,1284162,2225.0,2225.0,Livestock,Agriculture,to purchase 6 bull-calves and 10 sheep for fattening and reselling.,KG,Kyrgyzstan,"Tyup district, Issyk-Kul region",KGS,171.0,2017-04-23 05:42:55,2017-03-22 07:00:00,2017-05-21 07:38:19,26.0,71,"#Repeat Borrower, #Animals, #Schooling, #Female Education",female,monthly,2017-04-23 00:00:00
283047,929781,200.0,200.0,Food,Food,to purchase seven sacks of cashew nuts.,KE,Kenya,Likoni,KES,164.0,2015-08-10 07:50:20,2015-08-10 07:00:00,2015-08-11 18:43:13,13.0,8,,female,irregular,2015-08-10 00:00:00
398983,1045368,175.0,175.0,Weaving,Arts,to buy yarn and colorant,ID,Indonesia,,IDR,129.0,2016-03-29 04:19:27,2016-03-14 07:00:00,2016-03-31 13:04:43,14.0,7,"user_favorite, #Fabrics, #Parent, #Woman Owned Biz",female,irregular,2016-03-29 00:00:00
215658,863522,1025.0,1025.0,Farming,Agriculture,to buy fertilizers and seeds for her farmland.,KH,Cambodia,"Kratie Province, Kratie District",KHR,204.0,2015-03-30 04:18:15,2015-02-28 08:00:00,2015-04-19 16:15:40,14.0,33,"#Woman Owned Biz, #Vegan, #Parent","female, female, female",monthly,2015-03-30 00:00:00
323420,970575,250.0,500.0,Personal Housing Expenses,Housing,"to buy galvanized metal sheets, wood, nails and wire for building a shelter for his poultry.",SV,El Salvador,,USD,81.0,2015-10-28 19:57:48,2015-09-30 07:00:00,,20.0,9,"user_favorite, #Elderly, #Animals",male,monthly,2015-10-28 00:00:00
214310,862273,350.0,350.0,Fruits & Vegetables,Food,"To add more stock of vegetables, mangoes and bananas ",KE,Kenya,"Mtito Andei , kibwezi",KES,133.0,2015-03-26 13:20:31,2015-03-11 07:00:00,2015-04-09 19:52:24,14.0,14,user_favorite,female,monthly,2015-03-26 00:00:00
376390,1023211,175.0,175.0,General Store,Retail,to purchase more stock to sell in her general store.,PH,Philippines,"Sibulan, Negros Oriental",PHP,145.0,2016-02-16 05:22:08,2016-01-21 08:00:00,2016-02-20 02:15:55,8.0,3,,female,irregular,2016-02-16 00:00:00
65078,1081543,125.0,125.0,Services,Services,"purchase a small digital printer, epson type for printing instant photos in my studio and also whenever i go for functions",KE,Kenya,,KES,,2014-05-28 15:39:35,2014-06-03 19:29:32,2014-06-03 02:38:52,3.0,3,,female,irregular,2014-05-28 00:00:00
663804,1326922,175.0,175.0,Grocery Store,Food,to buy more snacks and pigs to raise. ,CO,Colombia,Montería,COP,177.0,2017-06-23 17:13:54,2017-05-24 07:00:00,2017-07-08 01:28:38,10.0,5,"volunteer_pick, volunteer_like, #Animals, #Woman Owned Biz, #Elderly",female,bullet,2017-06-23 00:00:00
303434,950993,250.0,250.0,Food Production/Sales,Food,"to buy corn, which will allow her to make a larger and more varied production.",CO,Colombia,Cartagena de Indias,COP,154.0,2015-09-21 16:48:45,2015-08-31 07:00:00,2015-10-20 00:41:23,15.0,6,"#Elderly, #First Loan, #Woman Owned Biz",female,monthly,2015-09-21 00:00:00
14295,667091,175.0,175.0,General Store,Retail,"to buy items to sell like snack foods, sugar, soap, shampoo, canned goods, and other groceries.",PH,Philippines,"Narra, Palawan",PHP,145.0,2014-02-09 00:26:41,2014-01-30 08:00:00,2014-02-25 20:52:40,8.0,7,,female,irregular,2014-02-09 00:00:00
286062,932976,425.0,425.0,Food Production/Sales,Food,"to purchase ingredients like sugar, sticky rice, coconut, etc. for her food production business",PH,Philippines,"Tanjay, Negros Oriental",PHP,145.0,2015-08-16 15:47:11,2015-07-17 07:00:00,2015-09-11 19:41:26,11.0,15,"#Parent, #Woman Owned Biz",female,irregular,2015-08-16 00:00:00
253456,900609,800.0,800.0,Services,Services,"to buy more sheltering material such as wooden planks, bamboo and nails for her husband's sheltering services. ",PK,Pakistan,Lahore,PKR,247.0,2015-06-12 05:00:07,2015-06-09 07:00:00,2015-07-15 18:29:05,14.0,22,"#Unique, user_favorite","female, female",monthly,2015-06-12 00:00:00
481007,1141207,600.0,600.0,Agriculture,Agriculture,to buy alfalfa seeds.,PE,Peru,Arequipa,PEN,435.0,2016-08-27 17:44:51,2016-08-11 07:00:00,2016-09-17 15:48:59,14.0,19,"#Eco-friendly, #Sustainable Ag, user_favorite",male,monthly,2016-08-27 00:00:00
657776,1320464,500.0,500.0,Farming,Agriculture,to purchase fertilizers and seeds. The remaining funds will be used to pay school fees.,KE,Kenya,Kaloleni,KES,164.0,2017-06-15 09:21:05,2017-05-26 07:00:00,2017-07-03 12:59:38,14.0,13,"#Parent, #Woman Owned Biz, user_favorite, #Schooling, #Vegan",female,irregular,2017-06-15 00:00:00
